file_name,uni,wylie,url,dept,grade,char_len,audio_len,path,inf
STT_NS_M0311_0306_2165093_to_2171834,ཨ་ཅག་ཡ་ཡུད་ཞེད་སྣང་ཚ་བོ་ཆགས་བསྡད་ཤག་ཡོད་བ། ཨེ་ནས་སེམས་པ་ནི་སེམས་པ་སྐྱོ་སོང་ད་ཐབས་ཤེས་ནི་མི་འདུག་ཡོད་བ་ད། ང་ཚོ་ག་རེ་བྱེད་ཡ་ཡོད་རེད་ད་ཡོད་བ།  ,a cag ya yud zhed snang tsha bo chags bsdad shag yod ba/_e nas sems pa ni sems pa skyo song da thabs shes ni mi 'dug yod ba da/_nga tsho ga re byed ya yod red da yod ba/__,https://d38pmlk0v88drf.cloudfront.net/wav16k/STT_NS_M0311_0306_2165093_to_2171834.wav,STT_NS,3,140,6.741,wav16k/STT_NS_M0311_0306_2165093_to_2171834.wav,ཨ་ཅག་ཡ་ཡུད་ཞེད་སྣང་ཚ་བོ་ཆགས་བསྡད་ཤག་ཡོད་བ། ཨེ་ནས་སེམས་པ་ནི་སེམས་པ་སྐྱོ་སོང་ད་ཐབས་ཤེས་ནི་མི་འདུག་ཡོད་བ་ད་ང་ཚོ་ག་རེ་བྱེད་ཡ་ཡོད་རེད་ད་ཡོད་བ།
STT_NS_M0311_0307_2172653_to_2174957,ཨེམ་ཆི་ནི་ཡོད་བ་ཁ་ཤས་ཤིག་མ་ཤི་མི་འདུག་རཱ་ཡ།  ,em chi ni yod ba kha shas shig ma shi mi 'dug rA ya/__,https://d38pmlk0v88drf.cloudfront.net/wav16k/STT_NS_M0311_0307_2172653_to_2174957.wav,STT_NS,3,45,2.304,wav16k/STT_NS_M0311_0307_2172653_to_2174957.wav,ཨེམ་རཆེ་ནི་ཡོད་བ་ཁ་ཤས་ཤིག་མ་ཤས་མི་འདུག་རཱ་ཡ།
STT_NS_M0311_0309_2189462_to_2192619,ད་ང་ཚོ་དགོང་དག་རྒྱུགས་ལབ་ནས་ལབ་རཱ། ད་ནང་ལ་རང་འཇགས་ལོག་རྒྱུགས་ལབ་རེད།  ,da nga tsho dgong dag rgyugs lab nas lab rA/_da nang la rang 'jags log rgyugs lab red/__,https://d38pmlk0v88drf.cloudfront.net/wav16k/STT_NS_M0311_0309_2189462_to_2192619.wav,STT_NS,3,70,3.157,wav16k/STT_NS_M0311_0309_2189462_to_2192619.wav,ད་ང་ཚོ་དགོང་དག་རྒྱུགས་ལབ་ནས་ལབ་རཱ། ད་ནང་ལ་རང་འཇགས་ལོག་རྒྱུགས་ལབ་རེད།
STT_NS_M0322_0205_1449240_to_1459138,ད་ང་ཚོ་ཡོད་བ་ད་ངའི་ཀ་ཅི་ལོ་ཚད་ལབ་ན་ཡང་ངའི་ཀ་ཅི་ལོ་ཚད་ལབ་ན་ད་ང་ད་ཏོག་ཙི་ལོ་ཆུང་བ་འདྲ་བོ་རཱ། ང་ལོ་ཏོག་ཙི་ག་ལབ་དགོས་རེད། ད་ལྟ་ང་ལོ་བཅུ་དགུ་ཡིན་དུས་ཙམ་པ་ལ་ད་ལོ་ཉི་ཤུ་ཟིན་གྲབས་ཡོད་རཱ།  ,da nga tsho yod ba da nga'i ka ci lo tshad lab na yang nga'i ka ci lo tshad lab na da nga da tog tsi lo chung ba 'dra bo rA/_nga lo tog tsi ga lab dgos red/_da lta nga lo bcu dgu yin dus tsam pa la da lo nyi shu zin grabs yod rA/__,https://d38pmlk0v88drf.cloudfront.net/wav16k/STT_NS_M0322_0205_1449240_to_1459138.wav,STT_NS,3,180,9.898,wav16k/STT_NS_M0322_0205_1449240_to_1459138.wav,ད་ང་ཚོ་ཡོད་བ་ད་ངའི་ཀ་ཅི་ལོ་ཚད་ལབ་ན་ངའི་ཀ་ཅི་ལོ་ཚད་ལབ་ན་ད་ང་ད་ཏོག་ཙི་ལོ་ཆུང་བ་འདྲ་བོ་རང་ང་ལོ་ཏོག་ཙི་ག་ལབ་དགོས་རེད། ད་ལྟ་ང་ལོ་བཅུ་དགུ་ཡིན་དུས་ཙམ་པ་ལ་ད་ལོ་ཉི་ཤུ་ཟིན་གྲོ་ཡོད་རཱ།
STT_NS_M0322_0189_1342380_to_1349087,ངའི་ཀ་ཅི་སྤུན་རྒྱ་ཆུང་བ་འདྲ་བོ་དང་ཨེ་ནས་ངའི་སྤུན་རྒྱ་ཆུང་བ་ཀ་ཅི་ལོ་ཚད་གཅིག་པ་བུ་གུ་ཨེ་འདྲའི་ཡོད་རཱ། ད་ཁོ་ཚོ་འདྲ་བོ་ད་ཡོད་བ་རྦད་དེ་ཁོ་རང་ཡོད་བ།  ,nga'i ka ci spun rgya chung ba 'dra bo dang e nas nga'i spun rgya chung ba ka ci lo tshad gcig pa bu gu e 'dra'i yod rA/_da kho tsho 'dra bo da yod ba rbad de kho rang yod ba/__,https://d38pmlk0v88drf.cloudfront.net/wav16k/STT_NS_M0322_0189_1342380_to_1349087.wav,STT_NS,3,144,6.707,wav16k/STT_NS_M0322_0189_1342380_to_1349087.wav,ངའི་ཀ་ཅི་སྤུན་རྒྱ་ཆུང་བ་འདྲ་བོ་དང་ཨེ་ནས་ངའི་སྤུན་རྒྱ་ཆུང་བ་ཀ་ཅི་ལོ་ཚད་གཅིག་པ་བུ་གུ་ཨེ་འདྲའི་ཡོད་རཱ། ད་ཁོ་ཚོ་འདྲ་བོ་ད་ཡོད་བ་རྦད་དེ་ཁོ་རང་ཡོད་བ།
STT_TT00657_0413_3698131_to_3701220,ཁྱེད་རང་ཚོ་སེམས་ཁམས་རིག་པ། སེམས་སེམས་བྱུང་བལྟས་ཚར་རེད་བ།  ,khyed rang tsho sems khams rig pa/_sems sems byung bltas tshar red ba/__,https://d38pmlk0v88drf.cloudfront.net/wav16k/STT_TT00657_0413_3698131_to_3701220.wav,STT_TT,3,58,3.089,wav16k/STT_TT00657_0413_3698131_to_3701220.wav,ཁྱེད་རང་ཚོ་སེམས་ཁམས་རིག་པ། སེམས་སེམས་བྱུང་བལྟས་ཚར་རེད་བ།
STT_TT00657_0415_3712346_to_3720639,བྱས་ཙང་ཡུལ་གསུམ་དེ་ག་རེ་རེད་ལབ་ན། ཡུལ་གསུམ་དེ། ཀུན་ནས་མནར་སེམས་ཀི་དངོས་པོ་དགུ་སྐྱེ་ས་གི་གང་ཟག་གསུམ་དེ་རེད་བ།  ,byas tsang yul gsum de ga re red lab na/_yul gsum de/_kun nas mnar sems ki dngos po dgu skye sa gi gang zag gsum de red ba/__,https://d38pmlk0v88drf.cloudfront.net/wav16k/STT_TT00657_0415_3712346_to_3720639.wav,STT_TT,3,110,8.293,wav16k/STT_TT00657_0415_3712346_to_3720639.wav,བྱས་ཙང་། ཡུལ་གསུམ་དེ་ག་རེ་རེད་ལབ་ན། ཡུལ་གསུམ་དེ། ཀུན་ནས་མནར་སེམས་ཀི་དངོས་པོ་དགུ་སྐྱེ་ས་གི་གང་ཟག་གསུམ་དེ་རེད་བ།
STT_NS_M0322_0208_1478353_to_1481151,ང་ཚོ་ལག་པ་ལ་ཡོད་རྒྱོ་ཁ་པར་ད་ཨུང་།  ,nga tsho lag pa la yod rgyo kha par da ung /__,https://d38pmlk0v88drf.cloudfront.net/wav16k/STT_NS_M0322_0208_1478353_to_1481151.wav,STT_NS,3,35,2.798,wav16k/STT_NS_M0322_0208_1478353_to_1481151.wav,ང་ཚོའི་ལག་པ་ལ་ཡོད་རྒྱོ་ཁ་པར་དཨ།
STT_TT00667_0541_4814069_to_4820878,རེད་བ། ངའི་སྤུན་སྐྱ་འདྲ་བོ་ཡིན་པ་ཡིན་ན། སྙིང་རྗེ་ཟེར་ག་བྱས། སོ་སོ་གནོད་པ་སྐྱེལ་ན། ཁོ་འདི་དགོས་ཡོད་འདི་དགོས་ཡོད་ཁོ་ལ། ཨོ་དེ་ཨང་དེ།  ,red ba/_nga'i spun skya 'dra bo yin pa yin na/_snying rje zer ga byas/_so so gnod pa skyel na/_kho 'di dgos yod 'di dgos yod kho la/_o de ang de/__,https://d38pmlk0v88drf.cloudfront.net/wav16k/STT_TT00667_0541_4814069_to_4820878.wav,STT_TT,3,131,6.809,wav16k/STT_TT00667_0541_4814069_to_4820878.wav,རེད་བ། ངའི་སྤུན་རྒྱ་འདྲ་བོ་ཡིན་པ་ཡིན་ན། སྙིང་རྗེ་ཟེར་ཁ་བྱས། སོ་སོ་གནོད་པ་སྐྱེལ་ན། ཨོ་ཁོ་འདི་དགའས་ཡོད། འདི་དགོས་ཡོད་ཁོ་ལ། ཨོ་དེ། ཨོ་ད་དེ།
STT_NS_M0247_0154_1219069_to_1225674,དགོན་པ་ཕྱེད་ཀ་བཞེངས་རེད་ཡོད་བ། དགོན་པ་དེའི་དཀྱིལ་མ་ལ་དམིགས་བསལ་ག་རེ་ཡོད་རེད་ལབ་ན་དགོན་པ་དེའི་དཀྱིལ་མ་ལ་མིག་ཡོད་རེད་མིག་ང་ཚོ་མིའི་མིག་ཡོད་བ་འོ་དེ་འདྲ་བོ་མིག་གཉིས་ཡོད་རེད་ཡོད་བ།  ,dgon pa phyed ka bzhengs red yod ba/_dgon pa de'i dkyil ma la dmigs bsal ga re yod red lab na dgon pa de'i dkyil ma la mig yod red mig nga tsho mi'i mig yod ba 'o de 'dra bo mig gnyis yod red yod ba/__,https://d38pmlk0v88drf.cloudfront.net/wav16k/STT_NS_M0247_0154_1219069_to_1225674.wav,STT_NS,3,177,6.605,wav16k/STT_NS_M0247_0154_1219069_to_1225674.wav,དགོན་པ་ཕྱེད་ཀ་བཞེངས་རེད་ཡོད་བ། དགོན་པ་དེ་དཀྱིལ་མ་ལ་དམིགས་བསལ་ག་རེ་ཡོད་རེད་ལབ་ན། དགོན་པ་དེ་དཀྱིལ་མ་ལ་མིག་ཡོད་རེད། མིག་ང་ཚོ་མི་མིག་ཡོད་བ། ཨོ་ཨེ་འདྲའི་འདྲ་བོ་མིག་གཉིས་ཡོད་རེད་ཡོད་བ།
STT_NS_M0322_0191_1360366_to_1363882,རྦད་དེ་ཁོ་རང་ད་ཁོ་ཚོ་ལ་ད་རྦད་དེ་གོམས་ཚར་རེད་ཡོད་བ། ཨེ་ནས་ཨོ་ཙང་ད།  ,rbad de kho rang da kho tsho la da rbad de goms tshar red yod ba/_e nas o tsang da/__,https://d38pmlk0v88drf.cloudfront.net/wav16k/STT_NS_M0322_0191_1360366_to_1363882.wav,STT_NS,3,67,3.516,wav16k/STT_NS_M0322_0191_1360366_to_1363882.wav,རྦད་དེ་ཁོ་རང་ད་ཁོ་ཚོ་ལ་ད་རྦད་དེ་གོམས་ཚར་རེད་ཡོད་བ། ཨེ་ནས་ཨོ་ཙང་ད།
STT_NS_M0322_0197_1403335_to_1406807,ཡི་གེ་སྦྱང་དགོས་ཡོད་དུས་ཙམ་པ་ལ་ཨེ་ནས་ད་ཁ་པར་ཉོ་དགོས་ཐུབ་ཀི་རཱ། ཨེ་ནས་ཨོ་ཙང་ད།  ,yi ge sbyang dgos yod dus tsam pa la e nas da kha par nyo dgos thub ki rA/_e nas o tsang da/__,https://d38pmlk0v88drf.cloudfront.net/wav16k/STT_NS_M0322_0197_1403335_to_1406807.wav,STT_NS,3,79,3.472,wav16k/STT_NS_M0322_0197_1403335_to_1406807.wav,ཡི་གེ་སྦྱང་དགོས་ཡོད་དུས་ཙམ་པ་ལ་ཨེ་ནས་ད་ཁ་པར་ཉོ་དགོས་ཐུག་ཀི་རཱ། ཨེ་ནས་ཨོ་ཙང་ད།
STT_TT00657_0429_3896583_to_3899111,ཡང་དག་ཞེ་སྡང་སྐྱེ་བར་འདོད།  ,yang dag zhe sdang skye bar 'dod/__,https://d38pmlk0v88drf.cloudfront.net/wav16k/STT_TT00657_0429_3896583_to_3899111.wav,STT_TT,3,28,2.528,wav16k/STT_TT00657_0429_3896583_to_3899111.wav,ཡང་དག་ཞེ་སྡང་སྐྱེ་བར་འདོད།
STT_TT00657_0434_3940196_to_3942943,ད་དེ་རིང་འདི་བར་དུ། བཞག་ཡ་ཡིན། ད་བསྔོ་བ་གནང་ཨ།  ,da de ring 'di bar du/_bzhag ya yin/_da bsngo ba gnang a/__,https://d38pmlk0v88drf.cloudfront.net/wav16k/STT_TT00657_0434_3940196_to_3942943.wav,STT_TT,3,48,2.747,wav16k/STT_TT00657_0434_3940196_to_3942943.wav,ད་ད་རིང་འདི་བར་དུ་བཞག་ཡ་ཡིན། ད་བསྔོ་བ་གནང་ཨ།
STT_NS_M0322_0190_1349547_to_1356254,ཆུང་ཆུང་སྐབས་སུ་ནས་ཁོ་རང་ཡོད་བ་ད་ཁ་པར་ལབ་ཡ་འདི་ད་ལག་པ་ལ་རག་ཚར་རེད་ཡོད་བ། ཨེ་ནས་ད་ཁ་པར་མ་རག་རཱ། ཨེ་ནས་རྙོག་དྲ་བཤད་ཡ་འདྲ་བོ་དང་།  ,chung chung skabs su nas kho rang yod ba da kha par lab ya 'di da lag pa la rag tshar red yod ba/_e nas da kha par ma rag rA/_e nas rnyog dra bshad ya 'dra bo dang /__,https://d38pmlk0v88drf.cloudfront.net/wav16k/STT_NS_M0322_0190_1349547_to_1356254.wav,STT_NS,3,128,6.707,wav16k/STT_NS_M0322_0190_1349547_to_1356254.wav,ཆུང་ཆུང་སྐབས་སུ་ནས་ཁོ་རང་ཡོད་བ་ད་ཁ་པར་ལབ་ཡ་དེ་ད་ལག་པ་ལ་རག་ཚར་རེད་ཡོད་བ། ཨེ་ནས་ད་ཁ་པར་མ་རག་རཱ། ཨེ་ནས་རྙོག་གྲ་བཤད་ཡ་འདྲ་བོ་དང་།
STT_TT00657_0395_3523950_to_3530503,ཨོ་ཡ། ད་དེ་ནས། དེའི་ཁ་ཐུག་དེ་ལ་ཡ། དེ་སྦྱར་གི་ཡིན་ད། ཤོག་གུ་བརྒྱད་པའི། ད་གི་སྤྱོད་འཇུག་དེ། གཅིག་འགྲོ་ད།  ,o ya/_da de nas/_de'i kha thug de la ya/_de sbyar gi yin da/_shog gu brgyad pa'i/_da gi spyod 'jug de/_gcig 'gro da/__,https://d38pmlk0v88drf.cloudfront.net/wav16k/STT_TT00657_0395_3523950_to_3530503.wav,STT_TT,3,104,6.553,wav16k/STT_TT00657_0395_3523950_to_3530503.wav,ཨོ་ཡ། ད་དེ་ནས། དེའི་ཁ་ཐུག་དེ་ལ་ཡ། དེ་སྦྱར་གི་ཡིན་ད། ཤོག་གུ་བརྒྱད་པའི། ད་གིན་སྤྱོད་འཇུག་དེ་ཅིག་འགྲོ་ད།
STT_TT00657_0402_3585366_to_3590930,འཁོན་དུ་བཟུང་ནས་ཟེར་དུས། ཞེ་སྡང་གིས་རང་ལ་གནོད་པ་བསྐྱལ་པའི་དེ་ཚོ། ཨ་ནས། འཁོན་དུ་བཟུང་ནས་ཟེ།  ,'khon du bzung nas zer dus/_zhe sdang gis rang la gnod pa bskyal pa'i de tsho/_a nas/_'khon du bzung nas ze/__,https://d38pmlk0v88drf.cloudfront.net/wav16k/STT_TT00657_0402_3585366_to_3590930.wav,STT_TT,3,92,5.564,wav16k/STT_TT00657_0402_3585366_to_3590930.wav,འཁོན་དུ་བཟུང་ནས་ཟེར་དུས། ཞེ་སྡང་གིས་རང་ལ་གནོད་པ་སྐྱལ་པ་དེ་ཚོ། ཨེ་ནས་འཁོན་དུ་བཟུང་ནས་ཟེ།
STT_TT00657_0414_3702156_to_3705772,ཞེ་སྡང་དང་ཁྲོ་བ་དང་ཁོང་ཁྲོ་གསུམ་ཀ་གི་མཚན་ཉིད་ལ།  ,zhe sdang dang khro ba dang khong khro gsum ka gi mtshan nyid la/__,https://d38pmlk0v88drf.cloudfront.net/wav16k/STT_TT00657_0414_3702156_to_3705772.wav,STT_TT,3,49,3.616,wav16k/STT_TT00657_0414_3702156_to_3705772.wav,ཞེ་སྡང་དང་ཁྲོ་བ་དང་ཁོང་ཁྲོ་གསུམ་ག་གི་མཚན་ཉིད་ལ།
STT_NS_M0322_0195_1386985_to_1393365,ཁ་པར་གིས་བརྒྱུད་ནས་ཨེ་ནས་ད་ང་ཚོ་གི་གློག་ཀླད་ཀིས་བརྒྱུད་ནས་ད་ལབ་དགོས་རཱ། ཨེ་ནས་ཨེ་འདྲའི་བརྒྱུད་ནས་ད་ང་ཚོ་ད་ཕར།  ,kha par gis brgyud nas e nas da nga tsho gi glog klad kis brgyud nas da lab dgos rA/_e nas e 'dra'i brgyud nas da nga tsho da phar/__,https://d38pmlk0v88drf.cloudfront.net/wav16k/STT_NS_M0322_0195_1386985_to_1393365.wav,STT_NS,3,111,6.38,wav16k/STT_NS_M0322_0195_1386985_to_1393365.wav,ནཁ་པར་གི་བརྒྱུད་ནས་ཨེ་ནས་ད་ང་ཚོ་གི་གློག་ཀླད་ཀི་བརྒྱུད་ནས་ད་ལབ་དགོས་རཱ། ཨེ་ནས་ཨེ་འདྲའི་བརྒྱུད་ནས་ད་ང་ཚོ་ད་ཕར།
STT_TT00657_0418_3744106_to_3746378,མ་འོངས་པ་གནོད་པ་དེ་བྱེད་པར་འགྱུར་རོ།  ,ma 'ongs pa gnod pa de byed par 'gyur ro/__,https://d38pmlk0v88drf.cloudfront.net/wav16k/STT_TT00657_0418_3744106_to_3746378.wav,STT_TT,3,38,2.272,wav16k/STT_TT00657_0418_3744106_to_3746378.wav,མ་འོངས་པ་གནོད་པ་དེ་བྱེད་པར་འགྱུར་རོ།
STT_TT00657_0420_3787599_to_3790991,མ་འོངས་པ་ཕན་གདགས་པར་འགྱུར་རོ་ཟེ། དེ་ནས་ཕྲག་དོག་སྐྱེས་ནས། དེ་ནས་ཡང་ཁོང་ཁྲོ་ཟ་གོ་རེད་བ།  ,ma 'ongs pa phan gdags par 'gyur ro ze/_de nas phrag dog skyes nas/_de nas yang khong khro za go red ba/__,https://d38pmlk0v88drf.cloudfront.net/wav16k/STT_TT00657_0420_3787599_to_3790991.wav,STT_TT,3,87,3.392,wav16k/STT_TT00657_0420_3787599_to_3790991.wav,མ་འོངས་པ་ཕན་བཏགས་པར་འགྱུར་རོ་ཟེ། དེ་ནས་ཕྲག་དོག་སྐྱེས་ནས། དེ་ནས་ཡང་ཁོང་ཁྲོ་ཟ་གོ་རེད་བ།
STT_TT00657_0430_3908452_to_3911300,ཤེས་རབ་ལ་བརྟེན་ནས། ཞེ་སྡང་གི་རྩ་བ་འགོག་པར་བྱ། ཟེར་ཡ་དེ་རེད་ད།  ,shes rab la brten nas/_zhe sdang gi rtsa ba 'gog par bya/_zer ya de red da/__,https://d38pmlk0v88drf.cloudfront.net/wav16k/STT_TT00657_0430_3908452_to_3911300.wav,STT_TT,3,63,2.848,wav16k/STT_TT00657_0430_3908452_to_3911300.wav,ཤེས་རབ་ལ་བརྟེན་ནས་ ཞེ་སྡང་གི་རྩ་བ་འགོག་པར་བྱ། ཟེར་ཡ་དེ་རེད་ད།
STT_TT00657_0431_3911684_to_3914916,ཡང་ན་ཤེས་རབ་ལ་བརྟེན་ནས་ཞེ་སྡང་གི་རྩ་བ་འགོག་པར་བྱ་ཟེར་ཡ་དེ་ལ།  ,yang na shes rab la brten nas zhe sdang gi rtsa ba 'gog par bya zer ya de la/__,https://d38pmlk0v88drf.cloudfront.net/wav16k/STT_TT00657_0431_3911684_to_3914916.wav,STT_TT,3,62,3.232,wav16k/STT_TT00657_0431_3911684_to_3914916.wav,ཡང་ན་ཤེས་རབ་ལ་བརྟེན་ནས་ ཞེ་སྡང་གི་རྩ་བ་འགོག་པར་བྱ་ཟེར་ཡ་དེ་ལ།
STT_TT00657_0433_3929129_to_3931529,ཐུན་མཚམས་སྒྱུ་མའི་སྐྱེས་བུར་བྱ། ལབ་ཡ་དེ་ཚོ་ཡང་བསྒོམས་ཆོག་རེད།  ,thun mtshams sgyu ma'i skyes bur bya/_lab ya de tsho yang bsgoms chog red/__,https://d38pmlk0v88drf.cloudfront.net/wav16k/STT_TT00657_0433_3929129_to_3931529.wav,STT_TT,3,63,2.4,wav16k/STT_TT00657_0433_3929129_to_3931529.wav,ཐུན་མཚམས་སྒྱུ་མའི་སྐྱེས་བུར་བྱ། ལབ་ཡ་དེ་ཚོ་ཡང་སྒོམ་ཆོག་རེད།
STT_TT00658_0001_4991_to_10520,ཨོ། སངས་རྒྱས་ཆོས་དང་ཚོགས་ཀྱི་མཆོག་རྣམས་ལ། བྱང་ཆུབ་བར་དུ་བདག་ནི་སྐྱབས་སུ་ ,o/_sangs rgyas chos dang tshogs kyi mchog rnams la/_byang chub bar du bdag ni skyabs su _,https://d38pmlk0v88drf.cloudfront.net/wav16k/STT_TT00658_0001_4991_to_10520.wav,STT_TT,3,73,5.529,wav16k/STT_TT00658_0001_4991_to_10520.wav,ཨོ། སངས་རྒྱས་ཆོས་དང་ཚོགས་ཀྱི་མཆོག་རྣམས་ལ། བྱང་ཆུབ་བར་དུ་བདག་ནི་སྐྱབསསུ་
STT_NS_M0322_0228_1622619_to_1628438,མཛེས་མདོག་ཁ་བོ་འདུག་བསམ་གི་འདུག་རཱ། ཁ་ཤས་ཡང་སྤྱང་པོ་ཡོད་རཱ། ཡིན་ན་ཡང་སོ་སོ་གི་ད་ག་ལབ་དགོས་རེད།  ,mdzes mdog kha bo 'dug bsam gi 'dug rA/_kha shas yang spyang po yod rA/_yin na yang so so gi da ga lab dgos red/__,https://d38pmlk0v88drf.cloudfront.net/wav16k/STT_NS_M0322_0228_1622619_to_1628438.wav,STT_NS,3,96,5.819,wav16k/STT_NS_M0322_0228_1622619_to_1628438.wav,བཟས་མདོག་ཁ་བོ་འདུག་བསམ་གི་འདུག་རཱ། ཁ་ཤས་ཡང་སྤྱང་པོ་ཡོད་རཱ། ཡིན་ན་ཡང་སོ་སོ་གི་ད་ག་ལབ་དགོས་རེད།
STT_NS_M0311_0276_1925298_to_1928796,ཨ་ཅག་ཡ་ཡུད་མྱངས་རྒྱོ་འདྲ་བོ་མཐོང་རཱ་ཡ། ཡ་ཡུད་ཞེད་སྣང་ཚ་བོ་འདྲ་བོ་འདུག་མི་འདུག་བེ།  ,a cag ya yud myangs rgyo 'dra bo mthong rA ya/_ya yud zhed snang tsha bo 'dra bo 'dug mi 'dug be/__,https://d38pmlk0v88drf.cloudfront.net/wav16k/STT_NS_M0311_0276_1925298_to_1928796.wav,STT_NS,3,83,3.498,wav16k/STT_NS_M0311_0276_1925298_to_1928796.wav,ཨ་ཅག་ཡ་ཡུད་མྱང་རྒྱོ་འདྲ་བོ་མཐོང་རཱ་ཡང་། ཡ་ཡུད་ཞེད་སྣང་ཚ་བོ་འདྲ་བོ་འདུག་མི་འདུག་བེ།
STT_NS_M0311_0279_1944358_to_1946378,དངུལ་སྤྲད་དགོས་བྱས། དེའི་སྒང་ལ་ཨ་ཅག་ཀ་ཅི།  ,dngul sprad dgos byas/_de'i sgang la a cag ka ci/__,https://d38pmlk0v88drf.cloudfront.net/wav16k/STT_NS_M0311_0279_1944358_to_1946378.wav,STT_NS,3,43,2.02,wav16k/STT_NS_M0311_0279_1944358_to_1946378.wav,དངུལ་སྤྲད་དགོས་བྱས། དེའི་སྒང་ལ་ཨ་ཅག་ཀ་ཅི།
STT_NS_M0311_0288_2010622_to_2012921,ཨ་མ་ལགས་ངས་ལབ་ཡིན་པ། ཨ་མ་ལགས་ངེད་གཉིས་ད་ཐུག་གར་འགྲོ་ནས།  ,a ma lags ngas lab yin pa/_a ma lags nged gnyis da thug gar 'gro nas/__,https://d38pmlk0v88drf.cloudfront.net/wav16k/STT_NS_M0311_0288_2010622_to_2012921.wav,STT_NS,3,57,2.299,wav16k/STT_NS_M0311_0288_2010622_to_2012921.wav,ཨ་མ་ལགས་ངས་ལབ་ཡིན་པ། ཨ་མ་ལགས་ང་གཉིས་ད་ཐུག་ག་འགྲོ་ནས།
STT_NS_M0311_0295_2104872_to_2108131,ཨ་ཅག་གི་འགྲམ་ལ་ཡོད་རཱ། ད་མི་མང་པོ་འདུག་རཱ་ཡ། ནད་པ་མང་པོ་འདུག་ད་རཱ།  ,a cag gi 'gram la yod rA/_da mi mang po 'dug rA ya/_nad pa mang po 'dug da rA/__,https://d38pmlk0v88drf.cloudfront.net/wav16k/STT_NS_M0311_0295_2104872_to_2108131.wav,STT_NS,3,68,3.259,wav16k/STT_NS_M0311_0295_2104872_to_2108131.wav,ཨ་ཅག་གི་འགྲམ་ལ་ཡོད་རཱ། ད་མི་མང་པོ་འདུག་རཱ་ཡང་། ནད་པ་མང་པོ་འདུག་ད་རཱ།
STT_NS_M0311_0263_1816800_to_1822653,ཨེ་ནས་ད་ཞེད་སྣང་ཚ་བོ་ང་ད་ལྟ་བར་དུ་མི་ཨེ་འདྲའི་ཞེད་སྣང་ཚ་བོ་མྱངས་རྒྱོ་འདྲ་བོ་ལབ་ན་རེད། ཨེ་འདྲའི་མཐོང་མྱོང་ཁོ་རང་མེད་ཡོད་བ།  ,e nas da zhed snang tsha bo nga da lta bar du mi e 'dra'i zhed snang tsha bo myangs rgyo 'dra bo lab na red/_e 'dra'i mthong myong kho rang med yod ba/__,https://d38pmlk0v88drf.cloudfront.net/wav16k/STT_NS_M0311_0263_1816800_to_1822653.wav,STT_NS,3,123,5.853,wav16k/STT_NS_M0311_0263_1816800_to_1822653.wav,ཨེ་འདྲའི་ཞེད་སྣང་ཚ་བོ་ ང་ད་ལྟ་བར་དུ་མི་ཨེ་འདྲའི་ཞེད་སྣང་ཚ་བོ་མྱང་རྒྱོ་འདྲ་བོ་ལབ་ན་རེད། ཨེ་འདྲའི་མཐོང་མྱོང་ཁོ་རང་མེད་ཡོད་བ།
STT_NS_M0311_0264_1823370_to_1829581,ད་ཨོ་དེ་ཡང་ང་རང་ད་སོ་སོ་ཨ་ཅག་དཔེ་སྙིང་ཉེ་བོ་ཡོད་རཱ་ཡ། ཨེ་འདྲའི་འདྲ་བོ་མཐོང་དུས་ཙམ་པ་ཡ་ཡུད་དངམ་སྐྲག་འདྲ་བོ་སྐྱེས། ང་རང་ང་རང་ཅིག ,da o de yang nga rang da so so a cag dpe snying nye bo yod rA ya/_e 'dra'i 'dra bo mthong dus tsam pa ya yud dngam skrag 'dra bo skyes/_nga rang nga rang cig_,https://d38pmlk0v88drf.cloudfront.net/wav16k/STT_NS_M0311_0264_1823370_to_1829581.wav,STT_NS,3,127,6.211,wav16k/STT_NS_M0311_0264_1823370_to_1829581.wav,ད་ཨོ་དེ་ཡང་ང་རང་ད་སོ་སོ་ཨ་ཅག་དཔེ་སྙིང་ཉེ་བོ་ཡོད་རཱ་ཡང། ཨེ་འདྲའི་འདྲ་བོ་མཐོང་དུས་ཙམ་པ་ཡ་ཡུད་དངམ་སྐྲག་འདྲ་བོ་སྐྱེས། ང་རང་ང་རང་ཅིག
